{
  "id": "cups-12",
  "slug": "knight-of-cups",
  "name": "Knight of Cups",
  "arcana": "minor",
  "numeral": "Kn",
  "rank": 12,
  "suit": "cups",
  "symbolism": {
    "goldenDawnTitle": "Prince of the Chariot of the Waters",
    "element": "Water",
    "esms": 1,
    "planetaryBody": null,
    "planetIndex": null,
    "zodiacSign": null,
    "signIndex": null,
    "decan": null,
    "decanRange": null,
    "chaldeanRuler": null,
    "chaldeanRulerIndex": null,
    "triplicitySign": null,
    "triplicityRuler": null,
    "triplicityRulerIndex": null,
    "triplicityRulerIndices": [],
    "hebrewLetter": null,
    "treeOfLifePath": null
  },
  "styling": {
    "glyph": "🜄",
    "suitGlyph": "🜄",
    "primaryColor": "#5f93d8",
    "accentColor": "#dce2f0",
    "frameStyle": "cups-court",
    "artAsset": "/assets/cards/minor/cups/12-knight.jpg",
    "fallbackArt": "/assets/suits/cups.jpg",
    "audioFrequencyHz": 540
  },
  "sacredStats": {
    "power": 24,
    "resonance": 52,
    "wisdom": 38,
    "charisma": 42,
    "intuition": 56,
    "adaptability": 24,
    "vitality": 24
  },
  "planetaryStats": {
    "solarAgency": 24,
    "lunarReceptivity": 49,
    "mercurialVelocity": 24,
    "venusianCoherence": 44,
    "martialImpetus": 24,
    "jovianExpansion": 24,
    "saturnianStructure": 24,
    "chironicAdaptation": 34,
    "uranianSurprisal": 24,
    "neptunianResonance": 47,
    "plutonicIntegration": 24
  },
  "planetaryAffinity": [
    0,
    3,
    0,
    0,
    0,
    0,
    0,
    0,
    3,
    0
  ],
  "scrabbleLetter": "N",
  "trickEngine": {
    "trickPower": 10,
    "counterValue": 0,
    "isHonour": false,
    "family": "minor",
    "biasedSuit": "Cups",
    "eligibleMelds": [
      "marriage",
      "royal-court"
    ]
  },
  "lore": {
    "keywords": [
      "Knight",
      "Water",
      "Court Archetype",
      "Magnitude ++"
    ],
    "upright": "Mature embodiment of Knight wielding Water consciousness at magnitude ++.",
    "reversed": "Misdirection of Knight's ++ temperament; emotional or tactical friction.",
    "description": "Prince of the Chariot of the Waters. Embodies the ++ magnitude of royal Water governance."
  }
}