{
  "id": "major-06",
  "slug": "the-lovers",
  "name": "The Lovers",
  "arcana": "major",
  "numeral": "VI",
  "rank": 6,
  "suit": "major",
  "symbolism": {
    "goldenDawnTitle": "The Children of the Voice; The Oracle of the Mighty Gods",
    "element": "Air",
    "esms": 3,
    "planetaryBody": null,
    "planetIndex": null,
    "zodiacSign": "Gemini",
    "signIndex": 2,
    "decan": null,
    "decanRange": null,
    "chaldeanRuler": null,
    "chaldeanRulerIndex": null,
    "triplicitySign": "Gemini",
    "triplicityRuler": "Mercury",
    "triplicityRulerIndex": 2,
    "triplicityRulerIndices": [
      2
    ],
    "hebrewLetter": "Zain (ז)",
    "treeOfLifePath": "17th Path (Binah to Tiphereth)"
  },
  "styling": {
    "glyph": "♊",
    "suitGlyph": "✦",
    "primaryColor": "#aebbd6",
    "accentColor": "#db7a47",
    "frameStyle": "alchemical-conjunction",
    "artAsset": "/assets/cards/major/06-the-lovers.jpg",
    "fallbackArt": "/assets/suits/swords.jpg",
    "audioFrequencyHz": 480
  },
  "sacredStats": {
    "power": 35,
    "resonance": 33,
    "wisdom": 53,
    "charisma": 35,
    "intuition": 40,
    "adaptability": 69,
    "vitality": 33
  },
  "planetaryStats": {
    "solarAgency": 37,
    "lunarReceptivity": 24,
    "mercurialVelocity": 66,
    "venusianCoherence": 24,
    "martialImpetus": 34,
    "jovianExpansion": 34,
    "saturnianStructure": 24,
    "chironicAdaptation": 44,
    "uranianSurprisal": 35,
    "neptunianResonance": 31,
    "plutonicIntegration": 31
  },
  "planetaryAffinity": [
    0,
    0,
    5,
    0,
    0,
    -5,
    0,
    0,
    0,
    0
  ],
  "scrabbleLetter": "L",
  "trickEngine": {
    "trickPower": 1060,
    "counterValue": 0,
    "isHonour": false,
    "family": "sign",
    "biasedSuit": "Swords",
    "eligibleMelds": [
      "celestial-triumph"
    ]
  },
  "lore": {
    "keywords": [
      "Union",
      "Harmony",
      "Duality",
      "Alignment",
      "Choice"
    ],
    "upright": "Alchemical marriage of sulfur and mercury; moral alignment and harmonic attraction.",
    "reversed": "Discord, inner conflict, poor choices, misalignment of purpose, codependency.",
    "description": "The two seekers beneath the outspread wings of Raphael, bathed in the warmth of the solar tree."
  }
}