{
  "id": "pentacles-12",
  "slug": "knight-of-pentacles",
  "name": "Knight of Pentacles",
  "arcana": "minor",
  "numeral": "Kn",
  "rank": 12,
  "suit": "pentacles",
  "symbolism": {
    "goldenDawnTitle": "Prince of the Chariot of Earth",
    "element": "Earth",
    "esms": 2,
    "planetaryBody": null,
    "planetIndex": null,
    "zodiacSign": null,
    "signIndex": null,
    "decan": null,
    "decanRange": null,
    "chaldeanRuler": null,
    "chaldeanRulerIndex": null,
    "triplicitySign": null,
    "triplicityRuler": null,
    "triplicityRulerIndex": null,
    "triplicityRulerIndices": [],
    "hebrewLetter": null,
    "treeOfLifePath": null
  },
  "styling": {
    "glyph": "🜃",
    "suitGlyph": "🜃",
    "primaryColor": "#74ab6c",
    "accentColor": "#f0a95e",
    "frameStyle": "pentacles-court",
    "artAsset": "/assets/cards/minor/pentacles/12-knight.jpg",
    "fallbackArt": "/assets/suits/pentacles.jpg",
    "audioFrequencyHz": 485
  },
  "sacredStats": {
    "power": 38,
    "resonance": 24,
    "wisdom": 24,
    "charisma": 24,
    "intuition": 24,
    "adaptability": 24,
    "vitality": 52
  },
  "planetaryStats": {
    "solarAgency": 24,
    "lunarReceptivity": 24,
    "mercurialVelocity": 24,
    "venusianCoherence": 24,
    "martialImpetus": 24,
    "jovianExpansion": 37,
    "saturnianStructure": 54,
    "chironicAdaptation": 24,
    "uranianSurprisal": 24,
    "neptunianResonance": 24,
    "plutonicIntegration": 39
  },
  "planetaryAffinity": [
    0,
    0,
    0,
    3,
    0,
    0,
    3,
    0,
    0,
    0
  ],
  "scrabbleLetter": "N",
  "trickEngine": {
    "trickPower": 10,
    "counterValue": 0,
    "isHonour": false,
    "family": "minor",
    "biasedSuit": "Pentacles",
    "eligibleMelds": [
      "marriage",
      "royal-court"
    ]
  },
  "lore": {
    "keywords": [
      "Knight",
      "Earth",
      "Court Archetype",
      "Magnitude ++"
    ],
    "upright": "Mature embodiment of Knight wielding Earth consciousness at magnitude ++.",
    "reversed": "Misdirection of Knight's ++ temperament; emotional or tactical friction.",
    "description": "Prince of the Chariot of Earth. Embodies the ++ magnitude of royal Earth governance."
  }
}