{
  "id": "pentacles-13",
  "slug": "queen-of-pentacles",
  "name": "Queen of Pentacles",
  "arcana": "minor",
  "numeral": "Q",
  "rank": 13,
  "suit": "pentacles",
  "symbolism": {
    "goldenDawnTitle": "Queen of the Thrones of Earth",
    "element": "Earth",
    "esms": 2,
    "planetaryBody": null,
    "planetIndex": null,
    "zodiacSign": null,
    "signIndex": null,
    "decan": null,
    "decanRange": null,
    "chaldeanRuler": null,
    "chaldeanRulerIndex": null,
    "triplicitySign": null,
    "triplicityRuler": null,
    "triplicityRulerIndex": null,
    "triplicityRulerIndices": [],
    "hebrewLetter": null,
    "treeOfLifePath": null
  },
  "styling": {
    "glyph": "🜃",
    "suitGlyph": "🜃",
    "primaryColor": "#74ab6c",
    "accentColor": "#f0a95e",
    "frameStyle": "pentacles-court",
    "artAsset": "/assets/cards/minor/pentacles/13-queen.jpg",
    "fallbackArt": "/assets/suits/pentacles.jpg",
    "audioFrequencyHz": 497
  },
  "sacredStats": {
    "power": 45,
    "resonance": 24,
    "wisdom": 24,
    "charisma": 24,
    "intuition": 24,
    "adaptability": 24,
    "vitality": 66
  },
  "planetaryStats": {
    "solarAgency": 24,
    "lunarReceptivity": 24,
    "mercurialVelocity": 24,
    "venusianCoherence": 24,
    "martialImpetus": 24,
    "jovianExpansion": 43,
    "saturnianStructure": 70,
    "chironicAdaptation": 24,
    "uranianSurprisal": 24,
    "neptunianResonance": 24,
    "plutonicIntegration": 47
  },
  "planetaryAffinity": [
    0,
    0,
    0,
    3,
    0,
    0,
    3,
    0,
    0,
    0
  ],
  "scrabbleLetter": "Q",
  "trickEngine": {
    "trickPower": 11,
    "counterValue": 0,
    "isHonour": false,
    "family": "minor",
    "biasedSuit": "Pentacles",
    "eligibleMelds": [
      "marriage",
      "royal-court"
    ]
  },
  "lore": {
    "keywords": [
      "Queen",
      "Earth",
      "Court Archetype",
      "Magnitude +++"
    ],
    "upright": "Mature embodiment of Queen wielding Earth consciousness at magnitude +++.",
    "reversed": "Misdirection of Queen's +++ temperament; emotional or tactical friction.",
    "description": "Queen of the Thrones of Earth. Embodies the +++ magnitude of royal Earth governance."
  }
}