{
  "id": "wands-11",
  "slug": "page-of-wands",
  "name": "Page of Wands",
  "arcana": "minor",
  "numeral": "P",
  "rank": 11,
  "suit": "wands",
  "symbolism": {
    "goldenDawnTitle": "Princess of the Shining Flame; The Rose of the Palace of Fire",
    "element": "Fire",
    "esms": 0,
    "planetaryBody": null,
    "planetIndex": null,
    "zodiacSign": null,
    "signIndex": null,
    "decan": null,
    "decanRange": null,
    "chaldeanRuler": null,
    "chaldeanRulerIndex": null,
    "triplicitySign": null,
    "triplicityRuler": null,
    "triplicityRulerIndex": null,
    "triplicityRulerIndices": [],
    "hebrewLetter": null,
    "treeOfLifePath": null
  },
  "styling": {
    "glyph": "🜂",
    "suitGlyph": "🜂",
    "primaryColor": "#db7a47",
    "accentColor": "#f6cf83",
    "frameStyle": "wands-court",
    "artAsset": "/assets/cards/minor/wands/11-page.jpg",
    "fallbackArt": "/assets/suits/wands.jpg",
    "audioFrequencyHz": 564
  },
  "sacredStats": {
    "power": 35,
    "resonance": 33,
    "wisdom": 24,
    "charisma": 35,
    "intuition": 24,
    "adaptability": 28,
    "vitality": 33
  },
  "planetaryStats": {
    "solarAgency": 37,
    "lunarReceptivity": 24,
    "mercurialVelocity": 29,
    "venusianCoherence": 24,
    "martialImpetus": 34,
    "jovianExpansion": 24,
    "saturnianStructure": 24,
    "chironicAdaptation": 24,
    "uranianSurprisal": 35,
    "neptunianResonance": 24,
    "plutonicIntegration": 31
  },
  "planetaryAffinity": [
    3,
    0,
    0,
    0,
    3,
    0,
    0,
    0,
    0,
    0
  ],
  "scrabbleLetter": "P",
  "trickEngine": {
    "trickPower": 9,
    "counterValue": 0,
    "isHonour": false,
    "family": "minor",
    "biasedSuit": "Wands",
    "eligibleMelds": [
      "marriage",
      "royal-court"
    ]
  },
  "lore": {
    "keywords": [
      "Page",
      "Fire",
      "Court Archetype",
      "Magnitude +"
    ],
    "upright": "Mature embodiment of Page wielding Fire consciousness at magnitude +.",
    "reversed": "Misdirection of Page's + temperament; emotional or tactical friction.",
    "description": "Princess of the Shining Flame; The Rose of the Palace of Fire. Embodies the + magnitude of royal Fire governance."
  }
}